<?xml version="1.0" encoding="UTF-8"?>
<!-- edited with XMLSpy v2005 U (http://www.xmlspy.com) by XMLSPY 2005 Professional Ed., Installed for 5 users (Schweiz Landesbibliothek) -->
<xs:schema xmlns:xs="http://www.w3.org/2001/XMLSchema" xmlns:viaduc="http://bar.admin.ch/gebrauchskopie/v1" xmlns="http://bar.admin.ch/gebrauchskopie/v1"
  targetNamespace="http://bar.admin.ch/gebrauchskopie/v1" elementFormDefault="qualified" attributeFormDefault="unqualified" version="4.1">
  <xs:include schemaLocation="ablieferung.xsd"/>
  <xs:include schemaLocation="paket.xsd"/>
  <xs:include schemaLocation="provenienz.xsd"/>
  <xs:include schemaLocation="ordnungssystem.xsd"/>
  <xs:include schemaLocation="ordnungssystemposition.xsd"/>
  <xs:include schemaLocation="dossier.xsd"/>
  <xs:include schemaLocation="dokument.xsd"/>
  <xs:include schemaLocation="ordner.xsd"/>
  <xs:include schemaLocation="datei.xsd"/>
  <xs:include schemaLocation="archivischerVorgang.xsd"/>
  <xs:include schemaLocation="zusatzDaten.xsd"/>
  <xs:element name="paket" type="paket"/>
  <xs:complexType name="paket" abstract="true">
    <xs:sequence>
      <xs:element name="generierungsdatum" type="xs:dateTime"/>
      <xs:element minOccurs="0" name="bestellinformation" type="text4"/>
    </xs:sequence>
    <xs:attribute name="schemaVersion" type="schemaVersion" use="required"/>
  </xs:complexType>

  <xs:complexType name="paketDIP">
    <xs:complexContent>
      <xs:extension base="paket">
        <xs:sequence>
          <xs:element name="inhaltsverzeichnis" type="inhaltsverzeichnisDIP"/>
          <xs:element name="ablieferung" type="ablieferungDIP"/>
          <xs:element maxOccurs="unbounded" minOccurs="0" name="archivischerVorgang" type="archivischerVorgang"/>
        </xs:sequence>
      </xs:extension>
    </xs:complexContent>
  </xs:complexType>

  <xs:complexType name="archivischerVorgang">
    <xs:sequence>
      <xs:element name="vorgangstyp" type="vorgangstyp"/>
      <xs:element name="beschreibung" type="beschreibung"/>
    </xs:sequence>
  </xs:complexType>

  <xs:complexType name="ablieferung" abstract="true">
    <xs:sequence>
      <xs:element name="ablieferungstyp" type="ablieferungstyp"/>
      <xs:element name="ablieferndeStelle" type="ablieferndeStelle"/>
      <xs:element name="entstehungszeitraum" type="historischerZeitraum" minOccurs="0">
        <xs:annotation>
          <xs:documentation xml:lang="de">Der Entstehungszeitraum der Ablieferung wird aus dem ältesten Entstehungsdatum und dem jüngsten Datum der Dokumente oder Dateien ermittelt, die der Ablieferung zugeordneten  sind. Der Zeitraum kann auch geschätzt sein.</xs:documentation>
          <xs:documentation xml:lang="en">The creation period of the submission is calculated from the earliest creation date and the most recent date of the documents or files allocated to the submission. The period may also be estimated.</xs:documentation>
          <xs:documentation xml:lang="fr">La période de création du versement est déterminée par la date de création la plus ancienne et par la date la plus récente des documents ou des fichiers , qui sont attribués au versement. La période peut aussi être estimée</xs:documentation>
          <xs:documentation xml:lang="it"/>
        </xs:annotation>
      </xs:element>
      <xs:element name="bemerkung" type="bemerkungAblieferung" minOccurs="0"/>
    </xs:sequence>
  </xs:complexType>

  <xs:complexType name="ablieferungDIP">
    <xs:complexContent>
      <xs:extension base="ablieferung">
        <xs:sequence>
          <xs:element name="ablieferungsnummer" type="ablieferungsnummer" minOccurs="0"/>
          <xs:element name="provenienz" type="provenienzDIP"/>
          <xs:element name="ordnungssystem" type="ordnungssystemDIP"/>
        </xs:sequence>
      </xs:extension>
    </xs:complexContent>
  </xs:complexType>

  <xs:complexType name="provenienz" abstract="true">
    <xs:sequence>
      <xs:element name="aktenbildnerName" type="aktenbildnerName"/>
      <xs:element name="systemName" type="systemName" minOccurs="0"/>
      <xs:element name="systemBeschreibung" type="systemBeschreibung" minOccurs="0"/>
      <xs:element name="verwandteSysteme" type="verwandteSysteme" minOccurs="0"/>
      <xs:element name="archivierungsmodusLoeschvorschriften" type="archivierungsmodusLoeschvorschriften" minOccurs="0"/>
      <xs:element name="registratur" type="registratur" minOccurs="0"/>
    </xs:sequence>
  </xs:complexType>

  <xs:complexType name="provenienzDIP">
    <xs:complexContent>
      <xs:extension base="provenienz"> </xs:extension>
    </xs:complexContent>
  </xs:complexType>

  <xs:complexType name="ordnungssystem" abstract="true">
    <xs:sequence>
      <xs:element name="name" type="nameOrdnungssystem"/>
      <xs:element name="generation" type="generation" minOccurs="0"/>
      <xs:element name="mitbenutzung" type="mitbenutzung" minOccurs="0"/>
      <xs:element name="bemerkung" type="bemerkungOrdnungssysstem" minOccurs="0"/>
    </xs:sequence>
  </xs:complexType>

  <xs:complexType name="ordnungssystemDIP">
    <xs:complexContent>
      <xs:extension base="ordnungssystem">
        <xs:sequence>
          <xs:element name="ordnungssystemposition" type="ordnungssystempositionDIP" maxOccurs="unbounded"/>
        </xs:sequence>
      </xs:extension>
    </xs:complexContent>
  </xs:complexType>

  <xs:complexType name="ordnungssystemposition" abstract="true">
    <xs:sequence>
      <xs:element name="nummer" type="nummer" minOccurs="0"/>
      <xs:element name="titel" type="titelOrdnungssystemposition" minOccurs="0"/>
      <xs:element name="federfuehrendeOrganisationseinheit" type="federfuehrendeOrganisationseinheitOrdnungssystemposition" minOccurs="0"/>
      <xs:element name="klassifizierungskategorie" type="klassifizierungskategorieOrdnungssystemposition" minOccurs="0"/>
      <xs:element name="datenschutz" type="datenschutzOrdnungssystemposition" minOccurs="0"/>
      <xs:element name="oeffentlichkeitsstatus" type="oeffentlichkeitsstatusOrdnungssystemposition" minOccurs="0"/>
      <xs:element name="oeffentlichkeitsstatusBegruendung" type="oeffentlichkeitsstatusBegruendungOrdnungssystemposition" minOccurs="0"/>
    </xs:sequence>
  </xs:complexType>

  <xs:complexType name="ordnungssystempositionDIP">
    <xs:complexContent>
      <xs:extension base="ordnungssystemposition">
        <xs:sequence>
          <xs:element name="ordnungssystemposition" type="ordnungssystempositionDIP" minOccurs="0" maxOccurs="unbounded"/>
          <xs:element name="dossier" type="dossierDIP" minOccurs="0" maxOccurs="unbounded"/>
        </xs:sequence>
        <xs:attribute name="id" type="idOrdnungssystemposition" use="required"/>
      </xs:extension>
    </xs:complexContent>
  </xs:complexType>

  <xs:complexType name="dossier" abstract="true">
    <xs:sequence>
      <xs:element name="aktenzeichen" type="aktenzeichen" minOccurs="0"/>
      <xs:element name="zusatzmerkmal" type="zusatzmerkmal" minOccurs="0"/>
      <xs:element name="titel" type="titelDossier"/>
      <xs:element name="inhalt" type="inhalt" minOccurs="0"/>
      <xs:element name="erscheinungsform" type="erscheinungsformDossier" minOccurs="0"/>
      <xs:element name="umfang" type="umfangDossier" minOccurs="0"/>
      <xs:element name="federfuehrendeOrganisationseinheit" type="federfuehrendeOrganisationseinheitDossier" minOccurs="0"/>
      <xs:element name="eroeffnungsdatum" type="historischerZeitpunkt" minOccurs="0">
        <xs:annotation>
          <xs:documentation xml:lang="de">Zeitpunkt, an dem das Dossier eröffnet worden ist.</xs:documentation>
          <xs:documentation xml:lang="en">Time point at which the dossier was opened.</xs:documentation>
          <xs:documentation xml:lang="fr">Moment où le dossier a été ouvert.</xs:documentation>
          <xs:documentation xml:lang="it"/>
        </xs:annotation>
      </xs:element>
      <xs:element name="abschlussdatum" type="historischerZeitpunkt" minOccurs="0">
        <xs:annotation>
          <xs:documentation xml:lang="de">Zeitpunkt, an dem das Dossier abgeschlossen worden ist.</xs:documentation>
          <xs:documentation xml:lang="en">Time point at which the dossier was opened.</xs:documentation>
          <xs:documentation xml:lang="fr">Moment où le dossier a été clos.</xs:documentation>
          <xs:documentation xml:lang="it"/>
        </xs:annotation>
      </xs:element>
      <xs:element name="entstehungszeitraum" type="historischerZeitraum">
        <xs:annotation>
          <xs:documentation xml:lang="de">Der Entstehungszeitraum des Dossiers wird aus dem ältesten Entstehungsdatum und dem jüngsten (Änderungs)datum aller dem Dossier zugeordneten Dokumente oder Dateien ermittelt. Der Zeitraum kann auch geschätzt sein.</xs:documentation>
          <xs:documentation xml:lang="en">The creation period of the dossier is calculated from the earliest creation date and the most recent (change) date of all the documents or files allocated to the dossier. The period may also be estimated.</xs:documentation>
          <xs:documentation xml:lang="fr">La période de création du dossier est déterminée par la date de création la plus ancienne et par la date (de modification) la plus récente de tous les documents ou fichiers attribués au dossier. La période peut aussi être estimée.</xs:documentation>
          <xs:documentation xml:lang="it"/>
        </xs:annotation>
      </xs:element>
      <xs:element name="entstehungszeitraumAnmerkung" type="entstehungszeitraumAnmerkung" minOccurs="0"/>
      <xs:element name="klassifizierungskategorie" type="klassifizierungskategorieDossier" minOccurs="0"/>
      <xs:element name="datenschutz" type="datenschutzDossier" minOccurs="0"/>
      <xs:element name="oeffentlichkeitsstatus" type="oeffentlichkeitsstatusDossier" minOccurs="0"/>
      <xs:element name="oeffentlichkeitsstatusBegruendung" type="oeffentlichkeitsstatusBegruendungDossier" minOccurs="0"/>
      <xs:element name="sonstigeBestimmungen" type="sonstigeBestimmungenDossier" minOccurs="0"/>
      <xs:element name="vorgang" type="vorgangAktivitaet" minOccurs="0" maxOccurs="unbounded">
        <xs:annotation>
          <xs:documentation xml:lang="de">Vorgangsobjekte repräsentieren einzelne, abgrenzbare Geschäftsfälle. Der Vorgang wird durchgeführt über eine Folge von einzelnen Aktivitäten. Einer einzelnen Aktivität sind in der Regel ein federführender Akteur zugewiesen.</xs:documentation>
          <xs:documentation xml:lang="en">Process representing separately identifiable business cases . A process is performed through a sequence of individual operations. To each single activity is usually leading actorassigned.</xs:documentation>
          <xs:documentation xml:lang="fr">Les objets du processus représentent des cas particuliers délimitables</xs:documentation>
          <xs:documentation xml:lang="it"/>
        </xs:annotation>
      </xs:element>
      <xs:element name="bemerkung" type="bemerkungDossier" minOccurs="0"/>
      <xs:element name="zusatzDaten" type="zusatzDaten" minOccurs="0"/>
    </xs:sequence>
    <xs:attribute name="id" type="idDossier" use="required"/>
  </xs:complexType>

  <xs:complexType name="dossierDIP" abstract="false">
    <xs:complexContent>
      <xs:extension base="dossier">
        <xs:sequence>
          <xs:element name="dossier" type="dossierDIP" minOccurs="0" maxOccurs="unbounded"/>
          <xs:element name="dokument" type="dokumentDIP" minOccurs="0" maxOccurs="unbounded"/>
          <xs:element name="dateiRef" type="dateiRef" minOccurs="0" maxOccurs="unbounded"/>
        </xs:sequence>
      </xs:extension>
    </xs:complexContent>
  </xs:complexType>

  <xs:complexType name="vorgangAktivitaet" mixed="true">
    <xs:sequence minOccurs="0">
      <xs:element name="titel" type="titelVorgang"/>
      <xs:element name="arbeitsanweisung" type="arbeitsanweisungVorgang" minOccurs="0"/>
      <xs:element name="federfuehrung" type="federfuehrungVorgang" minOccurs="0"/>
      <xs:element name="verweis" type="verweisVorgang" minOccurs="0" maxOccurs="unbounded"/>
      <xs:element name="bemerkung" type="bemerkungVorgang" minOccurs="0"/>
      <xs:element name="zusatzDaten" type="zusatzDaten" minOccurs="0"/>
      <xs:element name="aktivitaet" type="aktivitaet" minOccurs="0" maxOccurs="unbounded"/>
    </xs:sequence>
    <xs:attribute name="order" type="orderVorgang" use="optional"/>
  </xs:complexType>

  <xs:complexType name="aktivitaet">
    <xs:sequence>
      <xs:sequence>
        <xs:element name="vorschreibung" type="vorschreibungAktivitaet"/>
        <xs:element name="anweisung" type="anweisungAktivitaet" minOccurs="0"/>
        <xs:element name="bearbeiter" type="bearbeiterAktivitaet" minOccurs="0"/>
        <xs:element name="abschlussdatum" type="abschlussdatumAktivitaet" minOccurs="0"/>
        <xs:element name="verweis" type="verweisAktivitaet" minOccurs="0" maxOccurs="unbounded"/>
        <xs:element name="bemerkung" type="bemerkungAktivitaet" minOccurs="0" maxOccurs="unbounded"/>
        <xs:element name="zusatzDaten" type="zusatzDaten" minOccurs="0"/>
      </xs:sequence>
    </xs:sequence>
    <xs:attribute name="order" type="orderAktivitaet" use="optional"/>
  </xs:complexType>

  <xs:simpleType name="dateiRef">
    <xs:restriction base="xs:IDREFS">
      <xs:length value="1"/>
    </xs:restriction>
  </xs:simpleType>

  <xs:complexType name="dokument" abstract="true">
    <xs:sequence>
      <xs:element name="titel" type="titelDokument"/>
      <xs:element name="erscheinungsform" type="erscheinungsformDokument"/>
      <xs:element name="registrierdatum" type="historischerZeitpunkt" minOccurs="0">
        <xs:annotation>
          <xs:documentation xml:lang="de">Zeitpunkt an welchem das Dokument im System einem Dossier zugeordnet worden ist.</xs:documentation>
          <xs:documentation xml:lang="en">Time point at which a document was added to the dossier.</xs:documentation>
          <xs:documentation xml:lang="fr">Moment où le document est attribué à un dossier dans le système.</xs:documentation>
          <xs:documentation xml:lang="it"/>
        </xs:annotation>
      </xs:element>
      <xs:element name="entstehungszeitraum" type="historischerZeitraum" minOccurs="0">
        <xs:annotation>
          <xs:documentation xml:lang="de">Zeitliche Angabe über die Entstehung des Dokuments. Als Entstehung des Dokuments kann das Datum seiner Erstellung angegeben werden, oder den Zeitraum, in dem das Dokument entstanden ist (aus dem ältesten Entstehungsdatum und dem jüngsten Datum des Dokuments ermittelt). Der Zeitraum kann auch geschätzt sein.</xs:documentation>
          <xs:documentation xml:lang="en">Period of the origin of the document. As creation time of the document the date of its creation can be specified, or the period in which the document was created (determined from the oldest creation date and the most recent date of the document) . The period can also be estimated.</xs:documentation>
          <xs:documentation xml:lang="fr">Indications temporelles sur la création du document. Comme création du document peut être indiquée la date de son élaboration ou la période durant laquelle le document a été créé (déterminée par la date de création la plus ancienne et par la date du document le plus récent). La période peut aussi être estimée.</xs:documentation>
          <xs:documentation xml:lang="it"/>
        </xs:annotation>
      </xs:element>
      <xs:element name="klassifizierungskategorie" type="klassifizierungskategorieDokument" minOccurs="0"/>
      <xs:element name="datenschutz" type="datenschutzDokument" minOccurs="0"/>
      <xs:element name="oeffentlichkeitsstatus" type="oeffentlichkeitsstatusDokument" minOccurs="0"/>
      <xs:element name="oeffentlichkeitsstatusBegruendung" type="oeffentlichkeitsstatusBegruendungDokument" minOccurs="0"/>
      <xs:element name="sonstigeBestimmungen" type="sonstigeBestimmungenDokument" minOccurs="0"/>
      <xs:element name="bemerkung" type="bemerkungDokument" minOccurs="0"/>
      <xs:element name="zusatzDaten" type="zusatzDaten" minOccurs="0"/>
      <xs:element name="dateiRef" type="dateiRef" minOccurs="0" maxOccurs="unbounded"/>
    </xs:sequence>
    <xs:attribute name="id" type="idDokument" use="required"/>
  </xs:complexType>


  <xs:complexType name="dokumentDIP" abstract="false">
    <xs:complexContent>
      <xs:extension base="dokument"> </xs:extension>
    </xs:complexContent>
  </xs:complexType>

  <xs:complexType name="inhaltsverzeichnis" abstract="true">
    <xs:sequence/>
  </xs:complexType>

  <xs:complexType name="inhaltsverzeichnisDIP">
    <xs:complexContent>
      <xs:extension base="inhaltsverzeichnis">
        <xs:sequence>
          <xs:element name="ordner" type="ordnerDIP" minOccurs="0" maxOccurs="unbounded"/>
          <xs:element name="datei" type="dateiDIP" minOccurs="0" maxOccurs="unbounded"/>
        </xs:sequence>
      </xs:extension>
    </xs:complexContent>
  </xs:complexType>

  <xs:complexType name="datei" abstract="true">
    <xs:sequence>
      <xs:element name="name" type="nameDatei"/>
      <xs:element name="originalName" type="originalName" minOccurs="0"/>
      <xs:element name="pruefalgorithmus" type="pruefalgorithmus"/>
      <xs:element name="pruefsumme" type="pruefsumme"/>
      <xs:element name="eigenschaft" type="eigenschaftDatei" minOccurs="0" maxOccurs="unbounded">
        <xs:annotation>
          <xs:documentation xml:lang="de">Name und Wert von technischen Eigenschaften der Dateien wie z.B. Felddelemiter.</xs:documentation>
          <xs:documentation xml:lang="en">Name and value of technical properties of the files such as field delimiters.</xs:documentation>
          <xs:documentation xml:lang="fr">Nom et valeur des propriétés techniques des fichiers, p. ex.:séparateur de champs.</xs:documentation>
          <xs:documentation xml:lang="it"/>
        </xs:annotation>
      </xs:element>
    </xs:sequence>
    <xs:attribute name="id" type="idDatei" use="required"/>
  </xs:complexType>

  <xs:complexType name="dateiDIP">
    <xs:complexContent>
      <xs:extension base="datei"> </xs:extension>
    </xs:complexContent>
  </xs:complexType>

  <xs:complexType name="ordner" abstract="true">
    <xs:sequence>
      <xs:element name="name" type="nameOrdner"/>
      <xs:element name="originalName" type="originalName" minOccurs="0"/>
    </xs:sequence>
    <xs:attribute name="id" type="idOrdner" use="required"/>
  </xs:complexType>

  <xs:complexType name="ordnerDIP">
    <xs:complexContent>
      <xs:extension base="ordner">
        <xs:sequence>
          <xs:element name="ordner" type="ordnerDIP" minOccurs="0" maxOccurs="unbounded"/>
          <xs:element name="datei" type="dateiDIP" minOccurs="0" maxOccurs="unbounded"/>
        </xs:sequence>
      </xs:extension>
    </xs:complexContent>
  </xs:complexType>

  <xs:complexType name="eigenschaftDatei">
    <xs:simpleContent>
      <xs:extension base="eigenschaft">
        <xs:attribute name="name" type="text4" use="required"/>
      </xs:extension>
    </xs:simpleContent>
  </xs:complexType>

  <xs:simpleType name="umfangDossier">
    <xs:restriction base="text2"/>
  </xs:simpleType>
  <xs:simpleType name="signaturDokument">
    <xs:restriction base="text1"/>
  </xs:simpleType>
  <xs:simpleType name="formatDokument">
    <xs:restriction base="text1"/>
  </xs:simpleType>
  <xs:simpleType name="themaDokument">
    <xs:restriction base="text1"/>
  </xs:simpleType>
  <xs:simpleType name="urheberDokument">
    <xs:restriction base="text1"/>
  </xs:simpleType>
  <xs:simpleType name="verlegerDokument">
    <xs:restriction base="text1"/>
  </xs:simpleType>
  <xs:simpleType name="abdeckungDokument">
    <xs:restriction base="text1"/>
  </xs:simpleType>
</xs:schema>
