<?xml version="1.0" encoding="utf-8"?>
<paket xmlns:xsi="http://www.w3.org/2001/XMLSchema-instance" xmlns:xsd="http://www.w3.org/2001/XMLSchema" xsi:type="paketDIP" schemaVersion="4.1" xsi:schemaLocation="http://bar.admin.ch/gebrauchskopie/v1 gebrauchskopie.xsd" xmlns="http://bar.admin.ch/gebrauchskopie/v1">
  <generierungsdatum>2023-01-27T00:00:00+01:00</generierungsdatum>
  <inhaltsverzeichnis>
    <ordner id="contentRoot638104236070351768">
      <name>content</name>
      <originalName>content</originalName>
      <ordner id="_mUxkNuL5fRXDIoA0ozZqLg_D">
        <name>Fotoalben, II. Kategorie-Presse</name>
        <originalName>Fotoalben, II. Kategorie-Presse</originalName>
        <ordner id="_taVWf1zJIp1FZKolO5Y3wT_D">
          <name>U_m_s_c_h_l_a_g_0000007</name>
          <originalName>U_m_s_c_h_l_a_g_0000007</originalName>
          <datei id="_eBbhmyoh93kqg5Q9mKxvHe">
            <name>00000033.jp2</name>
            <originalName>00000033.jp2</originalName>
            <pruefalgorithmus>MD5</pruefalgorithmus>
            <pruefsumme>08f5941e25fd3e8ffd7c530e8dfbed65</pruefsumme>
          </datei>
          <datei id="_73B7cGbtqziRJC2iwLteKE">
            <name>00000033_PREMIS.xml</name>
            <originalName>00000033_PREMIS.xml</originalName>
            <pruefalgorithmus>MD5</pruefalgorithmus>
            <pruefsumme>df001fe1f0da7cd2f3c9ad05d8bfd969</pruefsumme>
          </datei>
          <datei id="_IycrymMJ1SNt4MkeLC3siH">
            <name>00000034.jp2</name>
            <originalName>00000034.jp2</originalName>
            <pruefalgorithmus>MD5</pruefalgorithmus>
            <pruefsumme>365052f8c83d40d84cab2295b800847e</pruefsumme>
          </datei>
          <datei id="_955fh7hzZRQw6mSgAtRDGN">
            <name>00000034_PREMIS.xml</name>
            <originalName>00000034_PREMIS.xml</originalName>
            <pruefalgorithmus>MD5</pruefalgorithmus>
            <pruefsumme>5c8f780f2c5343f785121f868886fefb</pruefsumme>
          </datei>
        </ordner>
        <ordner id="_zB6EW180t0wV4UUdaTKeD9_D">
          <name>D_o_k_u_m_e_n_t_0000009</name>
          <originalName>D_o_k_u_m_e_n_t_0000009</originalName>
          <datei id="_XWbO7fLO41dM4eLpm3zNU5">
            <name>00000035.jp2</name>
            <originalName>00000035.jp2</originalName>
            <pruefalgorithmus>MD5</pruefalgorithmus>
            <pruefsumme>d5bcbf316ad971cd757eb31369d0c7e9</pruefsumme>
          </datei>
          <datei id="_it74iySrrboN4MxdZvX9ZY">
            <name>00000035_PREMIS.xml</name>
            <originalName>00000035_PREMIS.xml</originalName>
            <pruefalgorithmus>MD5</pruefalgorithmus>
            <pruefsumme>478b5f26ccfa196410598b538ed71a2a</pruefsumme>
          </datei>
          <datei id="_orRFEWHWKLCJgf371va7RS">
            <name>00000036.jp2</name>
            <originalName>00000036.jp2</originalName>
            <pruefalgorithmus>MD5</pruefalgorithmus>
            <pruefsumme>4847c0aa538f2a6410245ebcc4da7419</pruefsumme>
          </datei>
          <datei id="_OZ7pEKhpdz7YsVKYbJORaQ">
            <name>00000036_PREMIS.xml</name>
            <originalName>00000036_PREMIS.xml</originalName>
            <pruefalgorithmus>MD5</pruefalgorithmus>
            <pruefsumme>b5eaf9877fd779589d986fb39f47b898</pruefsumme>
          </datei>
        </ordner>
      </ordner>
      <ordner id="_z5trSXo1v3VvQzSyMF4IXD_D">
        <name>Fotoalben, II. Kategorie-Presse</name>
        <originalName>Fotoalben, II. Kategorie-Presse</originalName>
        <ordner id="_7uWs6hIoIGYeI7gXT4ZegT_D">
          <name>U_m_s_c_h_l_a_g_0000010</name>
          <originalName>U_m_s_c_h_l_a_g_0000010</originalName>
          <datei id="_2ub0CB4GMrTvC2PiyM1PQc">
            <name>00000047.jp2</name>
            <originalName>00000047.jp2</originalName>
            <pruefalgorithmus>MD5</pruefalgorithmus>
            <pruefsumme>a6fa607248d27b0e6606fb51005e0db3</pruefsumme>
          </datei>
          <datei id="_kAnPAEjjzfNCLDaDeB8H3s">
            <name>00000047_PREMIS.xml</name>
            <originalName>00000047_PREMIS.xml</originalName>
            <pruefalgorithmus>MD5</pruefalgorithmus>
            <pruefsumme>ec555abe97fbbbddba214bce8c9c7d25</pruefsumme>
          </datei>
          <datei id="_nHiqdJcMrajZbdcKSCvNLp">
            <name>00000048.jp2</name>
            <originalName>00000048.jp2</originalName>
            <pruefalgorithmus>MD5</pruefalgorithmus>
            <pruefsumme>7274435bb0cb55d3a6cd05e15dcc5c13</pruefsumme>
          </datei>
          <datei id="_4awyYeXZfsKayQE9c8F25K">
            <name>00000048_PREMIS.xml</name>
            <originalName>00000048_PREMIS.xml</originalName>
            <pruefalgorithmus>MD5</pruefalgorithmus>
            <pruefsumme>e9509fdf631a4f496c23b97a744fd419</pruefsumme>
          </datei>
        </ordner>
        <ordner id="_89auFmJd9VvCnrDTtSrc3m_D">
          <name>D_o_k_u_m_e_n_t_0000012</name>
          <originalName>D_o_k_u_m_e_n_t_0000012</originalName>
          <datei id="_Ns6s4zDFoKTzxRlHyTqM6q">
            <name>00000049.jp2</name>
            <originalName>00000049.jp2</originalName>
            <pruefalgorithmus>MD5</pruefalgorithmus>
            <pruefsumme>dc6bbebbc0f252bd8f1d0fbd08e38bd5</pruefsumme>
          </datei>
          <datei id="_bqWtPrRZsxVlEG9nualW1E">
            <name>00000049_PREMIS.xml</name>
            <originalName>00000049_PREMIS.xml</originalName>
            <pruefalgorithmus>MD5</pruefalgorithmus>
            <pruefsumme>54465cdf1d3bff7e739f3892e025d8a0</pruefsumme>
          </datei>
          <datei id="_C1lngApdQCD4JFjnPx8U3c">
            <name>00000050.jp2</name>
            <originalName>00000050.jp2</originalName>
            <pruefalgorithmus>MD5</pruefalgorithmus>
            <pruefsumme>10494d043baca43484e78a498c8e2017</pruefsumme>
          </datei>
          <datei id="_WeqrVI77mUP4XJufk0kQ65">
            <name>00000050_PREMIS.xml</name>
            <originalName>00000050_PREMIS.xml</originalName>
            <pruefalgorithmus>MD5</pruefalgorithmus>
            <pruefsumme>8227f2f19670246d54b3d8eaacb5300d</pruefsumme>
          </datei>
          <datei id="_oXndN5shU4ERB5p5e3Tgzr">
            <name>00000051.jp2</name>
            <originalName>00000051.jp2</originalName>
            <pruefalgorithmus>MD5</pruefalgorithmus>
            <pruefsumme>b4bb9b9b7003d3f95860668faf24d9b6</pruefsumme>
          </datei>
          <datei id="_rEevNJifkC4LgWO9wo9zP4">
            <name>00000051_PREMIS.xml</name>
            <originalName>00000051_PREMIS.xml</originalName>
            <pruefalgorithmus>MD5</pruefalgorithmus>
            <pruefsumme>5b6806d6c66c31b126fc6ee08131c695</pruefsumme>
          </datei>
          <datei id="_B06ineIl2JnjUJuh7B3YOG">
            <name>00000052.jp2</name>
            <originalName>00000052.jp2</originalName>
            <pruefalgorithmus>MD5</pruefalgorithmus>
            <pruefsumme>7cd5c0010cf8be1785f2888638aff287</pruefsumme>
          </datei>
          <datei id="_ngjXVcoGjVwApnNYUPByex">
            <name>00000052_PREMIS.xml</name>
            <originalName>00000052_PREMIS.xml</originalName>
            <pruefalgorithmus>MD5</pruefalgorithmus>
            <pruefsumme>f96e965295696b9f5ca4435270f2feff</pruefsumme>
          </datei>
        </ordner>
      </ordner>
      <ordner id="_U1Q2qc6tW19iBdaWmtNImT_D">
        <name>Fotoalben, II. Kategorie-Presse</name>
        <originalName>Fotoalben, II. Kategorie-Presse</originalName>
        <ordner id="_T09Zd4fr3gkhz6kxCfCXz3_D">
          <name>U_m_s_c_h_l_a_g_0000002</name>
          <originalName>U_m_s_c_h_l_a_g_0000002</originalName>
          <datei id="_s0TXeLQ9pOWH22DXzh19f5">
            <name>00000009.jp2</name>
            <originalName>00000009.jp2</originalName>
            <pruefalgorithmus>MD5</pruefalgorithmus>
            <pruefsumme>1f5c7a293849609ad9a6e9209c2c886a</pruefsumme>
          </datei>
          <datei id="_dY3ODuf7ASaTCwfkqswGGD">
            <name>00000009_PREMIS.xml</name>
            <originalName>00000009_PREMIS.xml</originalName>
            <pruefalgorithmus>MD5</pruefalgorithmus>
            <pruefsumme>37c056288a7cd17cb954c88f9954f94c</pruefsumme>
          </datei>
          <datei id="_mk18IdtqC5mYHVTtArBeF5">
            <name>00000010.jp2</name>
            <originalName>00000010.jp2</originalName>
            <pruefalgorithmus>MD5</pruefalgorithmus>
            <pruefsumme>5f2bd14b4d7a85c455e6501111c1ce5f</pruefsumme>
          </datei>
          <datei id="_QRHP049r2Fq7DlYrz5Run0">
            <name>00000010_PREMIS.xml</name>
            <originalName>00000010_PREMIS.xml</originalName>
            <pruefalgorithmus>MD5</pruefalgorithmus>
            <pruefsumme>1379cdeee00258465aef908ce83186bf</pruefsumme>
          </datei>
        </ordner>
        <ordner id="_Tt845F3AcnO16RfzBSfbAB_D">
          <name>Brückensprengung</name>
          <originalName>Brückensprengung</originalName>
          <datei id="_4VAgaWp3aW2mpEgMyw4r5h">
            <name>00000011.jp2</name>
            <originalName>00000011.jp2</originalName>
            <pruefalgorithmus>MD5</pruefalgorithmus>
            <pruefsumme>223fb91b6fbfe1a6e07a41fcd891d9ea</pruefsumme>
          </datei>
          <datei id="_88owJkfwAGPXYHRHOtQi6x">
            <name>00000011_PREMIS.xml</name>
            <originalName>00000011_PREMIS.xml</originalName>
            <pruefalgorithmus>MD5</pruefalgorithmus>
            <pruefsumme>fc453d6a7e5168e4d014d63ac4837e6d</pruefsumme>
          </datei>
          <datei id="_rtEguCWcbzqtfNhC5qjgvY">
            <name>00000012.jp2</name>
            <originalName>00000012.jp2</originalName>
            <pruefalgorithmus>MD5</pruefalgorithmus>
            <pruefsumme>2941716b4b179581c603233f11cf6d66</pruefsumme>
          </datei>
          <datei id="_Lvq93TPGHUv8WZ5V9BqDpN">
            <name>00000012_PREMIS.xml</name>
            <originalName>00000012_PREMIS.xml</originalName>